{"$schema":"http://json-schema.org/draft-07/schema#","title":"FluxWorkflow","type":"object","required":["id","name","category","description","estimated_time","elicitation","steps","command_template","author","version"],"properties":{"id":{"type":"string","pattern":"^[a-z0-9-]+$"},"name":{"type":"string","minLength":5,"maxLength":80},"category":{"type":"string","enum":["dev","qa","marketing","ops"]},"description":{"type":"string","minLength":20,"maxLength":300},"estimated_time":{"type":"string"},"skills_used":{"type":"array","items":{"type":"string"}},"tags":{"type":"array","items":{"type":"string"}},"elicitation":{"type":"array","minItems":2,"items":{"type":"object","required":["id","question","type"],"properties":{"id":{"type":"string"},"question":{"type":"string"},"type":{"type":"string","enum":["text","select","boolean"]},"options":{"type":"array","items":{"type":"string"}}}}},"steps":{"type":"array","minItems":3,"items":{"type":"object","required":["order","title","prompt_template"],"properties":{"order":{"type":"integer"},"skill":{"type":["string","null"]},"title":{"type":"string"},"prompt_template":{"type":"string"}}}},"command_template":{"type":"string","minLength":50},"author":{"type":"string"},"version":{"type":"string","pattern":"^\\d+\\.\\d+\\.\\d+$"},"created_at":{"type":"string","pattern":"^\\d{4}-\\d{2}-\\d{2}$"}}}
