{"id":"api-integration","name":"Integrate an external API","category":"dev","description":"Research, architect and implement a clean external API integration with proper error handling, TypeScript types and documentation.","estimated_time":"4 hours – 2 days","skills_used":["SKILL-TECH-SEARCH","SKILL-ARCHITECT-FIRST","SKILL-CHECKLIST-RUNNER"],"tags":["api","integration","typescript","rest","sdk","external service"],"elicitation":[{"id":"api","question":"Which API are you integrating?","type":"text"},{"id":"purpose","question":"What will this integration do?","type":"text"},{"id":"stack","question":"Project stack and language?","type":"text"},{"id":"auth","question":"Authentication method?","type":"select","options":["API Key","OAuth 2.0","JWT","Basic Auth","Not sure yet"]}],"steps":[{"order":1,"skill":"SKILL-TECH-SEARCH","title":"Research SDK and best practices","prompt_template":"Research {api} integration best practices for {stack}. Auth: {auth}."},{"order":2,"skill":"SKILL-ARCHITECT-FIRST","title":"Design the integration layer","prompt_template":"Design the {api} integration layer. Define service class, error types, retry strategy."},{"order":3,"skill":null,"title":"Implement the integration","prompt_template":"Implement the {api} integration for {purpose}. Auth: {auth}."},{"order":4,"skill":"SKILL-CHECKLIST-RUNNER","title":"Validate integration quality","prompt_template":"Validate the {api} integration: no hardcoded credentials, error handling, TypeScript compliance."}],"command_template":"Integrate {api} into the project.\n\nPurpose: {purpose} | Stack: {stack} | Auth: {auth}\n\n1. SKILL-TECH-SEARCH → Research {api}: SDK vs HTTP client, rate limits, auth for {auth}, common failure modes.\n\n2. SKILL-ARCHITECT-FIRST → Design: service class interface, error type hierarchy, retry strategy, TypeScript types.\n\n3. Implement: service class, all credentials via env variables (never hardcoded), error handling for network errors/auth failures/rate limits.\n\n4. SKILL-CHECKLIST-RUNNER → Validate: no exposed credentials, all error paths handled, TypeScript strict mode passing.","author":"fluxrow","version":"1.0.0","created_at":"2026-05-05"}
