{"id":"n8n-automation","name":"Build a complete n8n automation","category":"dev","description":"Designs and implements a production-ready n8n workflow with proper error handling, retries, logging and system integrations.","estimated_time":"4–8 hours","skills_used":["SKILL-AUTOMATION-FLOWS","SKILL-TECH-SEARCH"],"tags":["n8n","automation","workflow","webhook","integration","crm","whatsapp"],"elicitation":[{"id":"trigger","question":"What triggers this automation?","type":"text"},{"id":"goal","question":"What should the automation accomplish?","type":"text"},{"id":"integrations","question":"Which systems does it connect?","type":"text"},{"id":"error_handling","question":"Error handling level?","type":"select","options":["Production-grade (retries, alerts, logging)","Basic (stop on error)","Minimal"]}],"steps":[{"order":1,"skill":"SKILL-AUTOMATION-FLOWS","title":"Map the flow","prompt_template":"Map the complete flow. Trigger: {trigger}. Goal: {goal}. Systems: {integrations}."},{"order":2,"skill":"SKILL-TECH-SEARCH","title":"Validate integrations","prompt_template":"Research the best way to integrate {integrations} in n8n."},{"order":3,"skill":null,"title":"Build the workflow","prompt_template":"Build the n8n workflow for: {goal}. Add error handling: {error_handling}."},{"order":4,"skill":null,"title":"Test and document","prompt_template":"Add {error_handling} and test with sample data. Document each node."}],"command_template":"Build a complete n8n automation.\n\nTrigger: {trigger}\nGoal: {goal}\nIntegrations: {integrations}\nError handling: {error_handling}\n\nUsing SKILL-AUTOMATION-FLOWS:\n\n1. Map the complete flow first — every node, every decision point, every error state.\n\n2. Research integrations — validate best approach for {integrations} in n8n.\n\n3. Build: implement each node with clear naming (verb + object format).\n\n4. Error handling ({error_handling}): error branches, retry logic, notification on critical failures.\n\n5. Document: add sticky notes explaining the purpose of each workflow section.","author":"fluxrow","version":"1.0.0","created_at":"2026-05-05"}
