{"id":"instagram-content","name":"Instagram content batch (30 posts)","category":"marketing","description":"Creates a full month of Instagram content: captions, image prompts, hashtags and posting schedule.","estimated_time":"2–3 hours","skills_used":["SKILL-CONTENT-SCALE"],"tags":["instagram","content","social media","copywriting","batch","calendar"],"elicitation":[{"id":"brand","question":"Brand or client name?","type":"text"},{"id":"niche","question":"What is the niche or industry?","type":"text"},{"id":"tone","question":"Brand tone of voice?","type":"select","options":["Professional and authoritative","Casual and fun","Inspirational","Educational","Direct and sales-focused"]},{"id":"goal","question":"Main content goal for this month?","type":"select","options":["Grow followers","Generate leads","Sell a product or service","Build brand authority","Educate the audience"]},{"id":"language","question":"Content language?","type":"select","options":["Portuguese (Brazil)","English","Spanish"]}],"steps":[{"order":1,"skill":"SKILL-CONTENT-SCALE","title":"Define content strategy","prompt_template":"Define the content strategy for {brand} ({niche}). Tone: {tone}. Goal: {goal}."},{"order":2,"skill":null,"title":"Generate 30 captions","prompt_template":"Write 30 Instagram captions for {brand}. 5 posts per content pillar. Language: {language}."},{"order":3,"skill":null,"title":"Create image prompts","prompt_template":"Write an AI image generation prompt for each of the 30 posts."},{"order":4,"skill":null,"title":"Build posting calendar","prompt_template":"Create a 30-day posting calendar for {brand}."}],"command_template":"Create a complete month of Instagram content for {brand}, a {niche} brand.\n\nTone: {tone} | Goal: {goal} | Language: {language}\n\nUsing SKILL-CONTENT-SCALE, deliver:\n\n1. Content strategy — 6 content pillars aligned with the goal: {goal}\n\n2. 30 captions in {language} — 5 per pillar. Each with hook, body, CTA.\n\n3. Image prompts — one per post, in English, photorealistic, bright, no text in image.\n\n4. Posting calendar — 30 days with date, pillar, caption reference and best posting time.\n\n5. Hashtag set — 30 tags organized by size (niche, mid, broad).","author":"fluxrow","version":"1.0.0","created_at":"2026-05-05"}
