{"id":"landing-page","name":"High-converting landing page","category":"marketing","description":"Builds a complete landing page optimized for conversion — strategy, copy, design and technical implementation.","estimated_time":"1–3 days","skills_used":["SKILL-FUNNEL-BUILDER","SKILL-FRONTEND-DESIGN"],"tags":["landing page","conversion","cro","copywriting","frontend"],"elicitation":[{"id":"product","question":"What is the product or service?","type":"text"},{"id":"audience","question":"Who is the target audience?","type":"text"},{"id":"offer","question":"What is the main offer and CTA?","type":"text"},{"id":"stack","question":"Tech stack for implementation?","type":"select","options":["Next.js","HTML + CSS + JS","Webflow","Framer"]}],"steps":[{"order":1,"skill":"SKILL-FUNNEL-BUILDER","title":"Define conversion structure","prompt_template":"Define the conversion structure for {product}. Audience: {audience}. Offer: {offer}."},{"order":2,"skill":null,"title":"Write all copy","prompt_template":"Write complete copy for the {product} landing page. All sections with headline variants and CTAs."},{"order":3,"skill":"SKILL-FRONTEND-DESIGN","title":"Design and implement","prompt_template":"Implement the landing page for {product} in {stack}. Mobile-first, fast loading."},{"order":4,"skill":null,"title":"Add tracking","prompt_template":"Add conversion tracking: page_view, cta_click, form_submit events."}],"command_template":"Build a high-converting landing page for {product}.\n\nAudience: {audience} | Main offer: {offer} | Stack: {stack}\n\n1. SKILL-FUNNEL-BUILDER → Structure: hero, problem, solution, proof, objections, CTA.\n\n2. Write all copy: 3 headline variants, subheadlines, body addressing top 3 objections, CTA variants.\n\n3. SKILL-FRONTEND-DESIGN → Implement in {stack}: mobile-first, under 2s load, accessible.\n\n4. Tracking → page_view, cta_click, form_submit events.","author":"fluxrow","version":"1.0.0","created_at":"2026-05-05"}
