{"id":"saas-mvp","name":"Build a SaaS MVP from scratch","category":"dev","description":"Orchestrates skills in sequence to build a complete SaaS MVP — from architecture design to production deploy.","estimated_time":"8–12 weeks","skills_used":["SKILL-ARCHITECT-FIRST","SKILL-TECH-SEARCH","SKILL-CHECKLIST-RUNNER"],"tags":["saas","mvp","next.js","supabase","launch","full-stack"],"elicitation":[{"id":"name","question":"What is the project name?","type":"text"},{"id":"stack","question":"What is the tech stack?","type":"select","options":["Next.js + Supabase","Next.js + Prisma + PostgreSQL","Remix + PlanetScale","Other"]},{"id":"target","question":"B2B or B2C?","type":"select","options":["B2B","B2C","Both"]},{"id":"payments","question":"Payment gateway?","type":"select","options":["Stripe","No payments needed","Other"]},{"id":"auth","question":"Authentication method?","type":"select","options":["Email + password","Magic link","OAuth (Google/GitHub)","All of the above"]}],"steps":[{"order":1,"skill":"SKILL-ARCHITECT-FIRST","title":"Define complete architecture","prompt_template":"Using SKILL-ARCHITECT-FIRST, define the complete architecture for {name}. Stack: {stack}. Target: {target}."},{"order":2,"skill":"SKILL-TECH-SEARCH","title":"Validate library choices","prompt_template":"Using SKILL-TECH-SEARCH, validate the best library choices for {stack} with a {target} product."},{"order":3,"skill":null,"title":"Implement core product","prompt_template":"Implement the core of {name} following the approved architecture. Stack: {stack}."},{"order":4,"skill":null,"title":"Add payments","prompt_template":"Implement {payments} integration for {name}."},{"order":5,"skill":"SKILL-CHECKLIST-RUNNER","title":"Validate before deploy","prompt_template":"Using SKILL-CHECKLIST-RUNNER, validate that {name} is ready for production deploy."}],"command_template":"We are building {name} — a {target} SaaS product.\n\nStack: {stack} | Auth: {auth} | Payments: {payments}\n\nMandatory execution sequence:\n\n1. SKILL-ARCHITECT-FIRST → Document complete architecture before any code. Database schema, API contracts, component tree, auth flow, payment flow. Get approval before proceeding.\n\n2. SKILL-TECH-SEARCH → Validate library choices for {stack}.\n\n3. Implement core → Database schema first, then auth ({auth}), then business logic, then API routes, then UI.\n\n4. Add {payments} → Subscriptions, webhooks, billing portal.\n\n5. SKILL-CHECKLIST-RUNNER → Validate security, error handling, env vars, mobile, loading states before deploy.\n\nGlobal rules: TypeScript always. Never write code without approved architecture. No hardcoded secrets.","author":"fluxrow","version":"1.0.0","created_at":"2026-05-05"}
